{
  "$schema": "https://github.com/onovich/Game-Primitives/blob/main/research/calibration-tests/continuous-action-pilot/schema/task-packet-0.1.0.schema.json",
  "allowed_observations": [],
  "artifact_type": "reconstruction_task_packet",
  "artifact_version": "0.1.0",
  "behavior_scope": "structural_only",
  "case_ids": [
    "CA-R2"
  ],
  "condition_id": "condition-v01",
  "created_at": "2026-07-26T17:52:08Z",
  "forbidden_actions": [
    "access_other_condition",
    "access_other_submission",
    "access_package_outside_dispatch",
    "access_truth_or_result",
    "create_child_task",
    "external_search",
    "read_shared_workspace",
    "tool_call"
  ],
  "input_artifacts": [
    {
      "artifact_id": "view-v01",
      "path": "research/calibration-tests/continuous-action-pilot/rehearsals/rehearsal-001/inputs/view-v01.json",
      "sha256": "c46650c9b9a0180d835f0d71a413180f95cce7d117bf0b3230ede257afd838e8"
    }
  ],
  "instructions": [
    "只根据随任务提供的条件视图回答，不得使用工具、网络、共享工作区、其他条件或既有项目上下文。",
    "恢复输入在何时被读取、状态怎样更新、同一步内的顺序，以及停止边界。",
    "说明这些事实能否唯一恢复；若不能，至少给出两个与视图相容的结构分支。",
    "不要猜测作品身份，不要评价体验、策略或游戏性。",
    "输出一份符合 role-submission 0.1.0 的 reconstruction_submission 首次提交。"
  ],
  "output_schema": {
    "path": "research/calibration-tests/continuous-action-pilot/schema/role-submission-0.1.0.schema.json",
    "sha256": "2688cc4787312fbadb928a073879727c084c1b0fc84bcea0388b647a0b55e3fe"
  },
  "representation_version": "CA-SR 0.1",
  "required_audit_checks": [],
  "run_id": "rehearsal-001",
  "stage1_submission_required": false,
  "stop_boundary_refs": [
    "stop.after-step-2"
  ],
  "target_encoding_sha256": null,
  "target_view_sha256": "c46650c9b9a0180d835f0d71a413180f95cce7d117bf0b3230ede257afd838e8",
  "task_id": "task.reconstruct.v01",
  "tolerance_rule_refs": [],
  "variant_interventions": []
}
